{
  "ftn_version": "1.0",
  "scenario_id": "SC_ADDON",
  "view": "topology",
  "observer": "P_PROVIDER",
  "as_of": "2026-10-17T09:30:00+08:00",
  "currencies": {
    "USD": 2
  },
  "assumptions": [
    "平台与 SaaS 费用账户均由同一个服务商 normalized ledger 维护；客户仅看总费用 2 USD。",
    "此图只承诺本地分配完成，未建模外部到账。"
  ],
  "parties": [
    {
      "id": "P_CUSTOMER",
      "name": "客户"
    },
    {
      "id": "P_PROVIDER",
      "name": "服务商"
    },
    {
      "id": "P_BANK",
      "name": "服务商银行"
    },
    {
      "id": "P_BENE",
      "name": "受益人"
    },
    {
      "id": "P_BENEBANK",
      "name": "受益人银行"
    },
    {
      "id": "P_PLATFORM",
      "name": "平台"
    }
  ],
  "ledgers": [
    {
      "id": "K1",
      "name": "服务商转移余额域",
      "custodian": "P_PROVIDER",
      "mode": "normalized"
    },
    {
      "id": "K_BANK",
      "name": "服务商银行账户域",
      "custodian": "P_BANK",
      "mode": "settlement"
    },
    {
      "id": "K_BENE",
      "name": "受益人银行账户域",
      "custodian": "P_BENEBANK",
      "mode": "settlement"
    }
  ],
  "accounts": [
    {
      "id": "A_WALLET",
      "name": "客户 USD 钱包",
      "owner": "P_CUSTOMER",
      "custodian": "P_PROVIDER",
      "ledger": "K1",
      "currency": "USD",
      "purpose": "wallet"
    },
    {
      "id": "A_TRANSIT",
      "name": "付款中间账户",
      "owner": "P_PROVIDER",
      "custodian": "P_PROVIDER",
      "ledger": "K1",
      "currency": "USD",
      "purpose": "transit"
    },
    {
      "id": "A_REVENUE",
      "name": "服务商费用收入",
      "owner": "P_PROVIDER",
      "custodian": "P_PROVIDER",
      "ledger": "K1",
      "currency": "USD",
      "purpose": "revenue"
    },
    {
      "id": "A_PROVIDER_BANK",
      "name": "服务商 USD 银行账户",
      "owner": "P_PROVIDER",
      "custodian": "P_BANK",
      "ledger": "K_BANK",
      "currency": "USD",
      "purpose": "bank"
    },
    {
      "id": "A_BENE_BANK",
      "name": "受益人 USD 银行账户",
      "owner": "P_BENE",
      "custodian": "P_BENEBANK",
      "ledger": "K_BENE",
      "currency": "USD",
      "purpose": "bank"
    },
    {
      "id": "A_PLATFORM_REVENUE",
      "name": "平台费用收入",
      "owner": "P_PLATFORM",
      "custodian": "P_PROVIDER",
      "ledger": "K1",
      "currency": "USD",
      "purpose": "revenue"
    }
  ],
  "operations": [
    {
      "id": "O_ADD",
      "name": "平台附加费本地分配",
      "required_legs": [
        "L1",
        "L2",
        "L3"
      ]
    }
  ],
  "batches": [
    {
      "id": "B_ADD",
      "ledger": "K1",
      "atomic": true,
      "composition": "split"
    }
  ],
  "legs": [
    {
      "id": "L1",
      "kind": "L",
      "from": "A_WALLET",
      "to": "A_TRANSIT",
      "money": {
        "currency": "USD",
        "minor": 10000
      },
      "operation_ref": "O_ADD",
      "effect_ref": "E_PRINCIPAL",
      "batch_ref": "B_ADD",
      "state": "posted",
      "knowledge": "known",
      "posted_at": "2026-10-17T09:00:00+08:00",
      "commit_ref": "commit:B1"
    },
    {
      "id": "L2",
      "kind": "L",
      "from": "A_WALLET",
      "to": "A_REVENUE",
      "money": {
        "currency": "USD",
        "minor": 100
      },
      "operation_ref": "O_ADD",
      "effect_ref": "E_SAAS_FEE",
      "batch_ref": "B_ADD",
      "state": "posted",
      "knowledge": "known",
      "posted_at": "2026-10-17T09:00:00+08:00",
      "commit_ref": "commit:B1"
    },
    {
      "id": "L3",
      "kind": "L",
      "from": "A_WALLET",
      "to": "A_PLATFORM_REVENUE",
      "money": {
        "currency": "USD",
        "minor": 100
      },
      "operation_ref": "O_ADD",
      "effect_ref": "E_PLATFORM_FEE",
      "batch_ref": "B_ADD",
      "state": "posted",
      "knowledge": "known",
      "posted_at": "2026-10-17T09:00:00+08:00",
      "commit_ref": "commit:B1"
    }
  ],
  "messages": [
    {
      "id": "M_QUOTE",
      "from_party": "P_PLATFORM",
      "to_party": "P_CUSTOMER",
      "type": "quote",
      "operation_ref": "O_ADD",
      "attempt_id": null,
      "idempotency_key": null,
      "occurred_at": "2026-10-17T09:00:00+08:00",
      "evidence": "log:M_QUOTE"
    },
    {
      "id": "M_BOOK",
      "from_party": "P_CUSTOMER",
      "to_party": "P_PLATFORM",
      "type": "book_order",
      "operation_ref": "O_ADD",
      "attempt_id": null,
      "idempotency_key": "PAY001",
      "occurred_at": "2026-10-17T09:00:00+08:00",
      "evidence": "log:M_BOOK"
    }
  ],
  "relations": []
}
