{
  "ftn_version": "1.0",
  "scenario_id": "SC_UNKNOWN",
  "view": "topology",
  "observer": "P_PROVIDER",
  "as_of": "2026-10-17T09:30:00+08:00",
  "currencies": {
    "USD": 2
  },
  "assumptions": [
    "构造示例，余额足够；未展开付款中间账户后续清理。",
    "本地 normalized 余额与外部银行账户分别观察，不能合计为支付次数。"
  ],
  "parties": [
    {
      "id": "P_CUSTOMER",
      "name": "客户"
    },
    {
      "id": "P_PROVIDER",
      "name": "服务商"
    },
    {
      "id": "P_BANK",
      "name": "服务商银行"
    },
    {
      "id": "P_BENE",
      "name": "受益人"
    },
    {
      "id": "P_BENEBANK",
      "name": "受益人银行"
    }
  ],
  "ledgers": [
    {
      "id": "K1",
      "name": "服务商转移余额域",
      "custodian": "P_PROVIDER",
      "mode": "normalized"
    },
    {
      "id": "K_BANK",
      "name": "服务商银行账户域",
      "custodian": "P_BANK",
      "mode": "settlement"
    },
    {
      "id": "K_BENE",
      "name": "受益人银行账户域",
      "custodian": "P_BENEBANK",
      "mode": "settlement"
    }
  ],
  "accounts": [
    {
      "id": "A_WALLET",
      "name": "客户 USD 钱包",
      "owner": "P_CUSTOMER",
      "custodian": "P_PROVIDER",
      "ledger": "K1",
      "currency": "USD",
      "purpose": "wallet"
    },
    {
      "id": "A_TRANSIT",
      "name": "付款中间账户",
      "owner": "P_PROVIDER",
      "custodian": "P_PROVIDER",
      "ledger": "K1",
      "currency": "USD",
      "purpose": "transit"
    },
    {
      "id": "A_REVENUE",
      "name": "服务商费用收入",
      "owner": "P_PROVIDER",
      "custodian": "P_PROVIDER",
      "ledger": "K1",
      "currency": "USD",
      "purpose": "revenue"
    },
    {
      "id": "A_PROVIDER_BANK",
      "name": "服务商 USD 银行账户",
      "owner": "P_PROVIDER",
      "custodian": "P_BANK",
      "ledger": "K_BANK",
      "currency": "USD",
      "purpose": "bank"
    },
    {
      "id": "A_BENE_BANK",
      "name": "受益人 USD 银行账户",
      "owner": "P_BENE",
      "custodian": "P_BENEBANK",
      "ledger": "K_BENE",
      "currency": "USD",
      "purpose": "bank"
    }
  ],
  "operations": [
    {
      "id": "O1",
      "name": "客户付款及服务费",
      "required_legs": [
        "L1",
        "L2",
        "F1"
      ]
    }
  ],
  "batches": [
    {
      "id": "B1",
      "ledger": "K1",
      "atomic": true,
      "composition": "split"
    }
  ],
  "legs": [
    {
      "id": "L1",
      "kind": "L",
      "from": "A_WALLET",
      "to": "A_TRANSIT",
      "money": {
        "currency": "USD",
        "minor": 10000
      },
      "operation_ref": "O1",
      "effect_ref": "E_PRINCIPAL",
      "batch_ref": "B1",
      "state": "posted",
      "knowledge": "known",
      "posted_at": "2026-10-17T09:00:00+08:00",
      "commit_ref": "commit:B1"
    },
    {
      "id": "L2",
      "kind": "L",
      "from": "A_WALLET",
      "to": "A_REVENUE",
      "money": {
        "currency": "USD",
        "minor": 100
      },
      "operation_ref": "O1",
      "effect_ref": "E_FEE",
      "batch_ref": "B1",
      "state": "posted",
      "knowledge": "known",
      "posted_at": "2026-10-17T09:00:00+08:00",
      "commit_ref": "commit:B1"
    },
    {
      "id": "F1",
      "kind": "F",
      "from": "A_PROVIDER_BANK",
      "to": "A_BENE_BANK",
      "money": {
        "currency": "USD",
        "minor": 10000
      },
      "operation_ref": "O1",
      "effect_ref": "E_PRINCIPAL",
      "batch_ref": null,
      "state": null,
      "knowledge": "unknown",
      "evidence": [
        "log:timeout:001"
      ],
      "confirmation_basis": null,
      "finality": "unassessed",
      "finality_rule_ref": null,
      "last_known_state": "submitted"
    }
  ],
  "messages": [
    {
      "id": "M1",
      "from_party": "P_PROVIDER",
      "to_party": "P_BANK",
      "type": "payment_request",
      "operation_ref": "O1",
      "attempt_id": "ATT1",
      "idempotency_key": "PAY001",
      "occurred_at": "2026-10-17T09:00:00+08:00",
      "evidence": "log:M1"
    },
    {
      "id": "M2",
      "from_party": "P_PROVIDER",
      "to_party": "P_BANK",
      "type": "query",
      "operation_ref": "O1",
      "attempt_id": "ATT1",
      "idempotency_key": null,
      "occurred_at": "2026-10-17T09:00:00+08:00",
      "evidence": "log:M2"
    }
  ],
  "relations": [
    {
      "type": "realizes",
      "from_ref": "F1",
      "to_ref": "L1"
    }
  ]
}
